{
  "component_kind": "palette",
  "content_hash": "sha256:354f4890bdfc5e0faa9ee4951cab160e8da2ac2e65bf0f2034300280fac45891",
  "id": "component-palette-a52433fdb147",
  "rationale": "KC approved the semantic Bioluminal Depth palette: dormant blue-slate, reinforced electric blue, saturated teal, scar_value intensity, scar_idle age dimming, and a dark floor-to-tip power ramp. Behavior, Look geometry, lighting, and camera remain fixed.",
  "schema_version": 1,
  "source_artifact_ref": "work/jobs/scar-tissue-chromatic-v7/package/scar-tissue-chromatic-v7.zip",
  "source_experiment_id": "experiment-scar-tissue-chromatic-v7",
  "state": "archived",
  "track": "chromatic",
  "visibility": "private"
}
